381	apple	55	Apple Inc..856.apple.1	An editorial article in " The Verge " in September 2016 by technology journalist Thomas Ricker explored some of the public 's perceived lack of innovation at Apple in recent years , specifically stating that Samsung has " matched and even surpassed Apple in terms of smartphone industrial design " and citing the belief that <target>Apple<target> is incapable of producing another breakthrough moment in technology with its products .	An editorial article in " The Verge " in September 2016 by technology journalist Thomas Ricker explored some of the public 's perceived lack of innovation at Apple in recent years , specifically stating that Samsung has " matched and even surpassed Apple in terms of smartphone industrial design " and citing the belief that Apple is incapable of producing another breakthrough moment in technology with its products .	An editorial article in "The Verge" in September 2016 by technology journalist Thomas Ricker explored some of the public's perceived lack of innovation at Apple in recent years, specifically stating that Samsung has "matched and even surpassed Apple in terms of smartphone industrial design" and citing the belief that Apple is incapable of producing another breakthrough moment in technology with its products.
382	apple	5	Apple Inc..856.apple.1	But it 's also how <target>Apple<target> does business .	But it 's also how Apple does business .	But it's also how Apple does business.
383	apple	68	Apple Inc..856.apple.1	Furthermore , he writes that " a device is only the starting point of an experience that will ultimately be ruled by the ecosystem in which it was spawned " , referring to how decent hardware products can still fail without a proper ecosystem ( specifically mentioning that Walkman did n't have an ecosystem to keep users from leaving once something better came along ) , but how <target>Apple<target> devices in different hardware segments are able to communicate and cooperate through the iCloud cloud service with features including Universal Clipboard ( in which text copied on one device can be pasted on a different device ) as well as inter - connected device functionality including Auto Unlock ( in which an Apple Watch can unlock a Mac in close proximity ) .	Furthermore , he writes that " a device is only the starting point of an experience that will ultimately be ruled by the ecosystem in which it was spawned " , referring to how decent hardware products can still fail without a proper ecosystem ( specifically mentioning that Walkman did n't have an ecosystem to keep users from leaving once something better came along ) , but how Apple devices in different hardware segments are able to communicate and cooperate through the iCloud cloud service with features including Universal Clipboard ( in which text copied on one device can be pasted on a different device ) as well as inter - connected device functionality including Auto Unlock ( in which an Apple Watch can unlock a Mac in close proximity ) .	Furthermore, he writes that "a device is only the starting point of an experience that will ultimately be ruled by the ecosystem in which it was spawned", referring to how decent hardware products can still fail without a proper ecosystem (specifically mentioning that Walkman didn't have an ecosystem to keep users from leaving once something better came along), but how Apple devices in different hardware segments are able to communicate and cooperate through the iCloud cloud service with features including Universal Clipboard (in which text copied on one device can be pasted on a different device) as well as inter-connected device functionality including Auto Unlock (in which an Apple Watch can unlock a Mac in close proximity).
384	apple	121	Apple Inc..856.apple.1	Furthermore , he writes that " a device is only the starting point of an experience that will ultimately be ruled by the ecosystem in which it was spawned " , referring to how decent hardware products can still fail without a proper ecosystem ( specifically mentioning that Walkman did n't have an ecosystem to keep users from leaving once something better came along ) , but how Apple devices in different hardware segments are able to communicate and cooperate through the iCloud cloud service with features including Universal Clipboard ( in which text copied on one device can be pasted on a different device ) as well as inter - connected device functionality including Auto Unlock ( in which an <target>Apple<target> Watch can unlock a Mac in close proximity ) .	Furthermore , he writes that " a device is only the starting point of an experience that will ultimately be ruled by the ecosystem in which it was spawned " , referring to how decent hardware products can still fail without a proper ecosystem ( specifically mentioning that Walkman did n't have an ecosystem to keep users from leaving once something better came along ) , but how Apple devices in different hardware segments are able to communicate and cooperate through the iCloud cloud service with features including Universal Clipboard ( in which text copied on one device can be pasted on a different device ) as well as inter - connected device functionality including Auto Unlock ( in which an Apple Watch can unlock a Mac in close proximity ) .	Furthermore, he writes that "a device is only the starting point of an experience that will ultimately be ruled by the ecosystem in which it was spawned", referring to how decent hardware products can still fail without a proper ecosystem (specifically mentioning that Walkman didn't have an ecosystem to keep users from leaving once something better came along), but how Apple devices in different hardware segments are able to communicate and cooperate through the iCloud cloud service with features including Universal Clipboard (in which text copied on one device can be pasted on a different device) as well as inter-connected device functionality including Auto Unlock (in which an Apple Watch can unlock a Mac in close proximity).
385	apple	3	Apple Inc..856.apple.1	He argues that <target>Apple<target> 's ecosystem is its greatest innovation .	He argues that Apple 's ecosystem is its greatest innovation .	He argues that Apple's ecosystem is its greatest innovation.  
386	apple	10	Apple Inc..856.apple.1	The Wall Street Journal " reported in June 2017 that <target>Apple<target> 's increased reliance on Siri , its virtual personal assistant , has raised questions about how much Apple can actually accomplish in terms of functionality .	The Wall Street Journal " reported in June 2017 that Apple 's increased reliance on Siri , its virtual personal assistant , has raised questions about how much Apple can actually accomplish in terms of functionality .	The Wall Street Journal" reported in June 2017 that Apple's increased reliance on Siri, its virtual personal assistant, has raised questions about how much Apple can actually accomplish in terms of functionality.
387	apple	28	Apple Inc..856.apple.1	The Wall Street Journal " reported in June 2017 that Apple 's increased reliance on Siri , its virtual personal assistant , has raised questions about how much <target>Apple<target> can actually accomplish in terms of functionality .	The Wall Street Journal " reported in June 2017 that Apple 's increased reliance on Siri , its virtual personal assistant , has raised questions about how much Apple can actually accomplish in terms of functionality .	The Wall Street Journal" reported in June 2017 that Apple's increased reliance on Siri, its virtual personal assistant, has raised questions about how much Apple can actually accomplish in terms of functionality.
388	apple	17	Apple Inc..856.apple.1	Whereas Google and Amazon make use of big data and analyze customer information to personalize results , <target>Apple<target> has a strong pro - privacy stance , intentionally not retaining user data .	Whereas Google and Amazon make use of big data and analyze customer information to personalize results , Apple has a strong pro - privacy stance , intentionally not retaining user data .	Whereas Google and Amazon make use of big data and analyze customer information to personalize results, Apple has a strong pro-privacy stance, intentionally not retaining user data.
389	apple	1	Apple Inc..856.apple.1	While <target>Apple<target> acquired an England - based startup specializing in conversational assistants , Google 's Assistant had already become capable of helping users select Wi - Fi networks by voice , and Siri was lagging in functionality .	While Apple acquired an England - based startup specializing in conversational assistants , Google 's Assistant had already become capable of helping users select Wi - Fi networks by voice , and Siri was lagging in functionality .	While Apple acquired an England-based startup specializing in conversational assistants, Google's Assistant had already become capable of helping users select Wi-Fi networks by voice, and Siri was lagging in functionality.  
390	apple	24	Apple Inc..856.apple.1	In December 2017 , two articles from " The Verge " and " ZDNet " debated what had been a particularly devastating week for <target>Apple<target> 's macOS and iOS software platforms .	In December 2017 , two articles from " The Verge " and " ZDNet " debated what had been a particularly devastating week for Apple 's macOS and iOS software platforms .	In December 2017, two articles from "The Verge" and "ZDNet" debated what had been a particularly devastating week for Apple's macOS and iOS software platforms.
391	apple	0	Apple Inc..856.apple.1	<target>Apple<target> released a security fix within a day and issued an apology , stating that " regrettably we stumbled " in regards to the security of the latest updates .	Apple released a security fix within a day and issued an apology , stating that " regrettably we stumbled " in regards to the security of the latest updates .	Apple released a security fix within a day and issued an apology, stating that "regrettably we stumbled" in regards to the security of the latest updates.
392	apple	16	Apple Inc..856.apple.1	After installing the security patch , however , file sharing was broken for users , with <target>Apple<target> releasing a support document with instructions to separately fix that issue .	After installing the security patch , however , file sharing was broken for users , with Apple releasing a support document with instructions to separately fix that issue .	After installing the security patch, however, file sharing was broken for users, with Apple releasing a support document with instructions to separately fix that issue.
393	apple	1	Apple Inc..856.apple.1	Though <target>Apple<target> publicly stated the promise of " auditing our development processes to help prevent this from happening again " , users who installed the security update while running the older 10.13.0 version of the High Sierra operating system rather than the then - newest 10.13.1 release experienced that the " root " security vulnerability was re - introduced , and persisted even after fully updating their systems .	Though Apple publicly stated the promise of " auditing our development processes to help prevent this from happening again " , users who installed the security update while running the older 10.13.0 version of the High Sierra operating system rather than the then - newest 10.13.1 release experienced that the " root " security vulnerability was re - introduced , and persisted even after fully updating their systems .	Though Apple publicly stated the promise of "auditing our development processes to help prevent this from happening again", users who installed the security update while running the older 10.13.0 version of the High Sierra operating system rather than the then-newest 10.13.1 release experienced that the "root" security vulnerability was re-introduced, and persisted even after fully updating their systems.
394	apple	0	Apple Inc..856.apple.1	<target>Apple<target> quickly released an update , done during the nighttime in Cupertino , California time and outside of their usual software release window , with one of the headlining features of the update needing to be delayed for a few days .	Apple quickly released an update , done during the nighttime in Cupertino , California time and outside of their usual software release window , with one of the headlining features of the update needing to be delayed for a few days .	Apple quickly released an update, done during the nighttime in Cupertino, California time and outside of their usual software release window, with one of the headlining features of the update needing to be delayed for a few days.
395	apple	25	Apple Inc..856.apple.1	The combined problems of the week on both macOS and iOS caused " The Verge"s Tom Warren to call it a " nightmare " for <target>Apple<target> 's software engineers and described it as a significant lapse in Apple 's ability to protect its more than 1 billion devices .	The combined problems of the week on both macOS and iOS caused " The Verge"s Tom Warren to call it a " nightmare " for Apple 's software engineers and described it as a significant lapse in Apple 's ability to protect its more than 1 billion devices .	The combined problems of the week on both macOS and iOS caused "The Verge"s Tom Warren to call it a "nightmare" for Apple's software engineers and described it as a significant lapse in Apple's ability to protect its more than 1 billion devices.
396	apple	37	Apple Inc..856.apple.1	The combined problems of the week on both macOS and iOS caused " The Verge"s Tom Warren to call it a " nightmare " for Apple 's software engineers and described it as a significant lapse in <target>Apple<target> 's ability to protect its more than 1 billion devices .	The combined problems of the week on both macOS and iOS caused " The Verge"s Tom Warren to call it a " nightmare " for Apple 's software engineers and described it as a significant lapse in Apple 's ability to protect its more than 1 billion devices .	The combined problems of the week on both macOS and iOS caused "The Verge"s Tom Warren to call it a "nightmare" for Apple's software engineers and described it as a significant lapse in Apple's ability to protect its more than 1 billion devices.
397	apple	23	Apple Inc..856.apple.1	ZDNet"s Adrian Kingsley - Hughes wrote that " it 's hard to not come away from the last week with the feeling that <target>Apple<target> is slipping " .	ZDNet"s Adrian Kingsley - Hughes wrote that " it 's hard to not come away from the last week with the feeling that Apple is slipping " .	ZDNet"s Adrian Kingsley-Hughes wrote that "it's hard to not come away from the last week with the feeling that Apple is slipping".
398	apple	33	Apple Inc..856.apple.1	Kingsley - Hughes also concluded his piece by referencing an earlier article , in which he wrote that " As much as I do n't want to bring up the tired old ' <target>Apple<target> would n't have done this under Steve Jobs 's watch ' trope , a lot of what 's happening at Apple lately is different from what they came to expect under Jobs .	Kingsley - Hughes also concluded his piece by referencing an earlier article , in which he wrote that " As much as I do n't want to bring up the tired old ' Apple would n't have done this under Steve Jobs 's watch ' trope , a lot of what 's happening at Apple lately is different from what they came to expect under Jobs .	Kingsley-Hughes also concluded his piece by referencing an earlier article, in which he wrote that "As much as I don't want to bring up the tired old 'Apple wouldn't have done this under Steve Jobs's watch' trope, a lot of what's happening at Apple lately is different from what they came to expect under Jobs.
399	apple	54	Apple Inc..856.apple.1	Kingsley - Hughes also concluded his piece by referencing an earlier article , in which he wrote that " As much as I do n't want to bring up the tired old ' Apple would n't have done this under Steve Jobs 's watch ' trope , a lot of what 's happening at <target>Apple<target> lately is different from what they came to expect under Jobs .	Kingsley - Hughes also concluded his piece by referencing an earlier article , in which he wrote that " As much as I do n't want to bring up the tired old ' Apple would n't have done this under Steve Jobs 's watch ' trope , a lot of what 's happening at Apple lately is different from what they came to expect under Jobs .	Kingsley-Hughes also concluded his piece by referencing an earlier article, in which he wrote that "As much as I don't want to bring up the tired old 'Apple wouldn't have done this under Steve Jobs's watch' trope, a lot of what's happening at Apple lately is different from what they came to expect under Jobs.
400	apple	32	Apple Inc..856.apple.1	Not to say that things did n't go wrong under his watch , but product announcements and launches felt a lot tighter for sure , as did the overall quality of what <target>Apple<target> was releasing .	Not to say that things did n't go wrong under his watch , but product announcements and launches felt a lot tighter for sure , as did the overall quality of what Apple was releasing .	Not to say that things didn't go wrong under his watch, but product announcements and launches felt a lot tighter for sure, as did the overall quality of what Apple was releasing.
401	apple	3	Apple Inc..856.apple.1	In 2011 , <target>Apple<target> 's profit margins were 40 percent , compared with between 10 and 20 percent for most other hardware companies .	In 2011 , Apple 's profit margins were 40 percent , compared with between 10 and 20 percent for most other hardware companies .	In 2011, Apple's profit margins were 40 percent, compared with between 10 and 20 percent for most other hardware companies.
402	apple	6	Apple Inc..856.apple.1	During the Mac 's early history <target>Apple<target> generally refused to adopt prevailing industry standards for hardware , instead creating their own .	During the Mac 's early history Apple generally refused to adopt prevailing industry standards for hardware , instead creating their own .	During the Mac's early history Apple generally refused to adopt prevailing industry standards for hardware, instead creating their own.
403	apple	12	Apple Inc..856.apple.1	This trend was largely reversed in the late 1990s , beginning with <target>Apple<target> 's adoption of the PCI bus in the 7500/8500/9500 Power Macs .	This trend was largely reversed in the late 1990s , beginning with Apple 's adoption of the PCI bus in the 7500/8500/9500 Power Macs .	This trend was largely reversed in the late 1990s, beginning with Apple's adoption of the PCI bus in the 7500/8500/9500 Power Macs.
404	apple	0	Apple Inc..856.apple.1	<target>Apple<target> has since joined the industry standards groups to influence the future direction of technology standards such as USB , AGP , HyperTransport , Wi - Fi , NVMe , PCIe and others in its products .	Apple has since joined the industry standards groups to influence the future direction of technology standards such as USB , AGP , HyperTransport , Wi - Fi , NVMe , PCIe and others in its products .	Apple has since joined the industry standards groups to influence the future direction of technology standards such as USB, AGP, HyperTransport, Wi-Fi, NVMe, PCIe and others in its products.
405	apple	3	Apple Inc..856.apple.1	FireWire is an <target>Apple<target> - originated standard that was widely adopted across the industry after it was standardized as IEEE 1394 and is a legally mandated port in all Cable TV boxes in the United States .	FireWire is an Apple - originated standard that was widely adopted across the industry after it was standardized as IEEE 1394 and is a legally mandated port in all Cable TV boxes in the United States .	FireWire is an Apple-originated standard that was widely adopted across the industry after it was standardized as IEEE 1394 and is a legally mandated port in all Cable TV boxes in the United States.  
406	apple	0	Apple Inc..856.apple.1	<target>Apple<target> has gradually expanded its efforts in getting its products into the Indian market .	Apple has gradually expanded its efforts in getting its products into the Indian market .	Apple has gradually expanded its efforts in getting its products into the Indian market.
407	apple	26	Apple Inc..856.apple.1	In July 2012 , during a conference call with investors , CEO Tim Cook said that he " [ loves ] India " , but that <target>Apple<target> saw larger opportunities outside the region .	In July 2012 , during a conference call with investors , CEO Tim Cook said that he " [ loves ] India " , but that Apple saw larger opportunities outside the region .	In July 2012, during a conference call with investors, CEO Tim Cook said that he "[loves] India", but that Apple saw larger opportunities outside the region.
408	apple	5	Apple Inc..856.apple.1	In October 2013 , Indian <target>Apple<target> executives unveiled a plan for selling devices through instalment plans and store - within - a - store concepts , in an effort to expand further into the market .	In October 2013 , Indian Apple executives unveiled a plan for selling devices through instalment plans and store - within - a - store concepts , in an effort to expand further into the market .	In October 2013, Indian Apple executives unveiled a plan for selling devices through instalment plans and store-within-a-store concepts, in an effort to expand further into the market.
409	apple	12	Apple Inc..856.apple.1	In March 2016 , " The Times of India " reported that <target>Apple<target> had sought permission from the Indian government to sell refurbished iPhones in the country .	In March 2016 , " The Times of India " reported that Apple had sought permission from the Indian government to sell refurbished iPhones in the country .	In March 2016, "The Times of India" reported that Apple had sought permission from the Indian government to sell refurbished iPhones in the country.
410	apple	4	Apple Inc..856.apple.1	In May 2016 , <target>Apple<target> opened an iOS app development center in Bangalore and a maps development office for 4,000 staff in Hyderabad .	In May 2016 , Apple opened an iOS app development center in Bangalore and a maps development office for 4,000 staff in Hyderabad .	In May 2016, Apple opened an iOS app development center in Bangalore and a maps development office for 4,000 staff in Hyderabad.
411	apple	4	Apple Inc..856.apple.1	In February 2017 , <target>Apple<target> once again requested permission to sell used iPhones in the country .	In February 2017 , Apple once again requested permission to sell used iPhones in the country .	In February 2017, Apple once again requested permission to sell used iPhones in the country.
412	apple	9	Apple Inc..856.apple.1	The same month , " Bloomberg " reported that <target>Apple<target> was close to receiving permission to open its first retail store in the country .	The same month , " Bloomberg " reported that Apple was close to receiving permission to open its first retail store in the country .	The same month, "Bloomberg" reported that Apple was close to receiving permission to open its first retail store in the country.
413	apple	11	Apple Inc..856.apple.1	In March , " The Wall Street Journal " reported that <target>Apple<target> would begin manufacturing iPhone models in India " over the next two months " , and in May , the " Journal " wrote that an Apple manufacturer had begun production of iPhone SE in the country , while Apple told " CNBC " that the manufacturing was for a " small number " of units .	In March , " The Wall Street Journal " reported that Apple would begin manufacturing iPhone models in India " over the next two months " , and in May , the " Journal " wrote that an Apple manufacturer had begun production of iPhone SE in the country , while Apple told " CNBC " that the manufacturing was for a " small number " of units .	In March, "The Wall Street Journal" reported that Apple would begin manufacturing iPhone models in India "over the next two months", and in May, the "Journal" wrote that an Apple manufacturer had begun production of iPhone SE in the country, while Apple told "CNBC" that the manufacturing was for a "small number" of units.
414	apple	38	Apple Inc..856.apple.1	In March , " The Wall Street Journal " reported that Apple would begin manufacturing iPhone models in India " over the next two months " , and in May , the " Journal " wrote that an <target>Apple<target> manufacturer had begun production of iPhone SE in the country , while Apple told " CNBC " that the manufacturing was for a " small number " of units .	In March , " The Wall Street Journal " reported that Apple would begin manufacturing iPhone models in India " over the next two months " , and in May , the " Journal " wrote that an Apple manufacturer had begun production of iPhone SE in the country , while Apple told " CNBC " that the manufacturing was for a " small number " of units .	In March, "The Wall Street Journal" reported that Apple would begin manufacturing iPhone models in India "over the next two months", and in May, the "Journal" wrote that an Apple manufacturer had begun production of iPhone SE in the country, while Apple told "CNBC" that the manufacturing was for a "small number" of units.
