487	apple	1	Apple Inc..856.apple.1	, <target>Apple<target> has around US$ 234billion of cash and marketable securities , of which 90 % is located outside the United States for tax purposes .	, Apple has around US$ 234billion of cash and marketable securities , of which 90 % is located outside the United States for tax purposes .	, Apple has around US$234billion of cash and marketable securities, of which 90% is located outside the United States for tax purposes.  
488	apple	0	Apple Inc..856.apple.1	<target>Apple<target> amassed 65 % of all profits made by the eight largest worldwide smartphone manufacturers in quarter one of 2014 , according to a report by Canaccord Genuity .	Apple amassed 65 % of all profits made by the eight largest worldwide smartphone manufacturers in quarter one of 2014 , according to a report by Canaccord Genuity .	Apple amassed 65% of all profits made by the eight largest worldwide smartphone manufacturers in quarter one of 2014, according to a report by Canaccord Genuity.
489	apple	14	Apple Inc..856.apple.1	On April 30 , 2017 , " The Wall Street Journal " reported that <target>Apple<target> had cash reserves of $ 250   billion , officially confirmed by Apple as specifically $ 256.8   billion a few days later .	On April 30 , 2017 , " The Wall Street Journal " reported that Apple had cash reserves of $ 250   billion , officially confirmed by Apple as specifically $ 256.8   billion a few days later .	On April 30, 2017, "The Wall Street Journal" reported that Apple had cash reserves of $250 billion, officially confirmed by Apple as specifically $256.8 billion a few days later.  
490	apple	27	Apple Inc..856.apple.1	On April 30 , 2017 , " The Wall Street Journal " reported that Apple had cash reserves of $ 250   billion , officially confirmed by <target>Apple<target> as specifically $ 256.8   billion a few days later .	On April 30 , 2017 , " The Wall Street Journal " reported that Apple had cash reserves of $ 250   billion , officially confirmed by Apple as specifically $ 256.8   billion a few days later .	On April 30, 2017, "The Wall Street Journal" reported that Apple had cash reserves of $250 billion, officially confirmed by Apple as specifically $256.8 billion a few days later.  
491	apple	1	Apple Inc..856.apple.1	, <target>Apple<target> was the largest publicly traded corporation in the world by market capitalization .	, Apple was the largest publicly traded corporation in the world by market capitalization .	, Apple was the largest publicly traded corporation in the world by market capitalization.
492	apple	6	Apple Inc..856.apple.1	On August 2 , 2018 , <target>Apple<target> became the first publicly traded U.S. company to reach a $ 1   trillion market value .	On August 2 , 2018 , Apple became the first publicly traded U.S. company to reach a $ 1   trillion market value .	On August 2, 2018, Apple became the first publicly traded U.S. company to reach a $1 trillion market value.
493	apple	0	Apple Inc..856.apple.1	<target>Apple<target> was ranked # 4 on the 2018 Fortune 500 rankings of the largest United States corporations by total revenue .	Apple was ranked # 4 on the 2018 Fortune 500 rankings of the largest United States corporations by total revenue .	Apple was ranked #4 on the 2018 Fortune 500 rankings of the largest United States corporations by total revenue.  
494	apple	0	Apple Inc..856.apple.1	<target>Apple<target> has created subsidiaries in low - tax places such as Ireland , the Netherlands , Luxembourg , and the British Virgin Islands to cut the taxes it pays around the world .	Apple has created subsidiaries in low - tax places such as Ireland , the Netherlands , Luxembourg , and the British Virgin Islands to cut the taxes it pays around the world .	Apple has created subsidiaries in low-tax places such as Ireland, the Netherlands, Luxembourg, and the British Virgin Islands to cut the taxes it pays around the world.
495	apple	12	Apple Inc..856.apple.1	According to " The New York Times , " in the 1980s <target>Apple<target> was among the first tech companies to designate overseas salespeople in high - tax countries in a manner that allowed the company to sell on behalf of low - tax subsidiaries on other continents , sidestepping income taxes .	According to " The New York Times , " in the 1980s Apple was among the first tech companies to designate overseas salespeople in high - tax countries in a manner that allowed the company to sell on behalf of low - tax subsidiaries on other continents , sidestepping income taxes .	According to "The New York Times," in the 1980s Apple was among the first tech companies to designate overseas salespeople in high-tax countries in a manner that allowed the company to sell on behalf of low-tax subsidiaries on other continents, sidestepping income taxes.
496	apple	5	Apple Inc..856.apple.1	In the late 1980s , <target>Apple<target> was a pioneer of an accounting technique known as the " Double Irish with a Dutch sandwich , " which reduces taxes by routing profits through Irish subsidiaries and the Netherlands and then to the Caribbean .	In the late 1980s , Apple was a pioneer of an accounting technique known as the " Double Irish with a Dutch sandwich , " which reduces taxes by routing profits through Irish subsidiaries and the Netherlands and then to the Caribbean .	In the late 1980s, Apple was a pioneer of an accounting technique known as the "Double Irish with a Dutch sandwich," which reduces taxes by routing profits through Irish subsidiaries and the Netherlands and then to the Caribbean.  
497	apple	18	Apple Inc..856.apple.1	Charlie Elphicke published research on October 30 , 2012 , which showed that some multinational companies , including <target>Apple<target> Inc. , were making billions of pounds of profit in the UK , but were paying an effective tax rate to the UK Treasury of only 3 percent , well below standard corporation tax .	Charlie Elphicke published research on October 30 , 2012 , which showed that some multinational companies , including Apple Inc. , were making billions of pounds of profit in the UK , but were paying an effective tax rate to the UK Treasury of only 3 percent , well below standard corporation tax .	Charlie Elphicke published research on October 30, 2012, which showed that some multinational companies, including Apple Inc., were making billions of pounds of profit in the UK, but were paying an effective tax rate to the UK Treasury of only 3 percent, well below standard corporation tax.
498	apple	0	Apple Inc..856.apple.1	<target>Apple<target> Inc. claims to be the single largest taxpayer to the Department of the Treasury of the United States of America with an effective tax rate of approximately of 26 % as of the second quarter of the Apple fiscal year 2016 .	Apple Inc. claims to be the single largest taxpayer to the Department of the Treasury of the United States of America with an effective tax rate of approximately of 26 % as of the second quarter of the Apple fiscal year 2016 .	Apple Inc. claims to be the single largest taxpayer to the Department of the Treasury of the United States of America with an effective tax rate of approximately of 26% as of the second quarter of the Apple fiscal year 2016.
499	apple	38	Apple Inc..856.apple.1	Apple Inc. claims to be the single largest taxpayer to the Department of the Treasury of the United States of America with an effective tax rate of approximately of 26 % as of the second quarter of the <target>Apple<target> fiscal year 2016 .	Apple Inc. claims to be the single largest taxpayer to the Department of the Treasury of the United States of America with an effective tax rate of approximately of 26 % as of the second quarter of the Apple fiscal year 2016 .	Apple Inc. claims to be the single largest taxpayer to the Department of the Treasury of the United States of America with an effective tax rate of approximately of 26% as of the second quarter of the Apple fiscal year 2016.
500	apple	17	Apple Inc..856.apple.1	In an interview with the German newspaper FAZ in October 2017 , Tim Cook stated , that <target>Apple<target> is the biggest taxpayer worldwide .	In an interview with the German newspaper FAZ in October 2017 , Tim Cook stated , that Apple is the biggest taxpayer worldwide .	In an interview with the German newspaper FAZ in October 2017, Tim Cook stated, that Apple is the biggest taxpayer worldwide.  
501	apple	6	Apple Inc..856.apple.1	In 2015 , Reuters reported that <target>Apple<target> had earnings abroad of $ 54.4billion which were untaxed by the IRS of the United States .	In 2015 , Reuters reported that Apple had earnings abroad of $ 54.4billion which were untaxed by the IRS of the United States .	In 2015, Reuters reported that Apple had earnings abroad of $54.4billion which were untaxed by the IRS of the United States.
502	apple	30	Apple Inc..856.apple.1	Under U.S. tax law governed by the IRC , corporations do n't pay income tax on overseas profits unless the profits are repatriated into the United States and as such <target>Apple<target> argues that to benefit its shareholders it will leave it overseas until a repatriation holiday or comprehensive tax reform takes place in the United States .	Under U.S. tax law governed by the IRC , corporations do n't pay income tax on overseas profits unless the profits are repatriated into the United States and as such Apple argues that to benefit its shareholders it will leave it overseas until a repatriation holiday or comprehensive tax reform takes place in the United States .	Under U.S. tax law governed by the IRC, corporations don't pay income tax on overseas profits unless the profits are repatriated into the United States and as such Apple argues that to benefit its shareholders it will leave it overseas until a repatriation holiday or comprehensive tax reform takes place in the United States.  
503	apple	18	Apple Inc..856.apple.1	It was not until 2018 that Irish economists could definitively prove that the 2015 growth was due to <target>Apple<target> restructuring its controversial double Irish subsidiaries ( Apple Sales International ) , which Apple converted into a new Irish capital allowances for intangible assets tax scheme ( expires in January 2020 ) .	It was not until 2018 that Irish economists could definitively prove that the 2015 growth was due to Apple restructuring its controversial double Irish subsidiaries ( Apple Sales International ) , which Apple converted into a new Irish capital allowances for intangible assets tax scheme ( expires in January 2020 ) .	It was not until 2018 that Irish economists could definitively prove that the 2015 growth was due to Apple restructuring its controversial double Irish subsidiaries (Apple Sales International), which Apple converted into a new Irish capital allowances for intangible assets tax scheme (expires in January 2020).
504	apple	26	Apple Inc..856.apple.1	It was not until 2018 that Irish economists could definitively prove that the 2015 growth was due to Apple restructuring its controversial double Irish subsidiaries ( <target>Apple<target> Sales International ) , which Apple converted into a new Irish capital allowances for intangible assets tax scheme ( expires in January 2020 ) .	It was not until 2018 that Irish economists could definitively prove that the 2015 growth was due to Apple restructuring its controversial double Irish subsidiaries ( Apple Sales International ) , which Apple converted into a new Irish capital allowances for intangible assets tax scheme ( expires in January 2020 ) .	It was not until 2018 that Irish economists could definitively prove that the 2015 growth was due to Apple restructuring its controversial double Irish subsidiaries (Apple Sales International), which Apple converted into a new Irish capital allowances for intangible assets tax scheme (expires in January 2020).
505	apple	32	Apple Inc..856.apple.1	It was not until 2018 that Irish economists could definitively prove that the 2015 growth was due to Apple restructuring its controversial double Irish subsidiaries ( Apple Sales International ) , which <target>Apple<target> converted into a new Irish capital allowances for intangible assets tax scheme ( expires in January 2020 ) .	It was not until 2018 that Irish economists could definitively prove that the 2015 growth was due to Apple restructuring its controversial double Irish subsidiaries ( Apple Sales International ) , which Apple converted into a new Irish capital allowances for intangible assets tax scheme ( expires in January 2020 ) .	It was not until 2018 that Irish economists could definitively prove that the 2015 growth was due to Apple restructuring its controversial double Irish subsidiaries (Apple Sales International), which Apple converted into a new Irish capital allowances for intangible assets tax scheme (expires in January 2020).
506	apple	30	Apple Inc..856.apple.1	The affair required the Central Bank of Ireland to create a new measure of Irish economic growth , Modified GNI * to replace Irish GDP , given the distortion of <target>Apple<target> 's tax schemes .	The affair required the Central Bank of Ireland to create a new measure of Irish economic growth , Modified GNI * to replace Irish GDP , given the distortion of Apple 's tax schemes .	The affair required the Central Bank of Ireland to create a new measure of Irish economic growth, Modified GNI* to replace Irish GDP, given the distortion of Apple's tax schemes.
507	apple	18	Apple Inc..856.apple.1	On August 30 , 2016 , after a two - year investigation , the EU Competition Commissioner concluded <target>Apple<target> received " illegal State aid " from Ireland .	On August 30 , 2016 , after a two - year investigation , the EU Competition Commissioner concluded Apple received " illegal State aid " from Ireland .	On August 30, 2016, after a two-year investigation, the EU Competition Commissioner concluded Apple received "illegal State aid" from Ireland.
508	apple	3	Apple Inc..856.apple.1	The EU ordered <target>Apple<target> to pay 13billion euros ( $ 14.5billion ) , plus interest , in unpaid Irish taxes for 2004 - 2014 .	The EU ordered Apple to pay 13billion euros ( $ 14.5billion ) , plus interest , in unpaid Irish taxes for 2004 - 2014 .	The EU ordered Apple to pay 13billion euros ($14.5billion), plus interest, in unpaid Irish taxes for 2004-2014.
509	apple	4	Apple Inc..856.apple.1	The Commission found that <target>Apple<target> had benefitted from a private Irish Revenue Commissioners tax ruling regarding its double Irish tax structure , Apple Sales International ( ASI ) .	The Commission found that Apple had benefitted from a private Irish Revenue Commissioners tax ruling regarding its double Irish tax structure , Apple Sales International ( ASI ) .	The Commission found that Apple had benefitted from a private Irish Revenue Commissioners tax ruling regarding its double Irish tax structure, Apple Sales International (ASI).
510	apple	22	Apple Inc..856.apple.1	The Commission found that Apple had benefitted from a private Irish Revenue Commissioners tax ruling regarding its double Irish tax structure , <target>Apple<target> Sales International ( ASI ) .	The Commission found that Apple had benefitted from a private Irish Revenue Commissioners tax ruling regarding its double Irish tax structure , Apple Sales International ( ASI ) .	The Commission found that Apple had benefitted from a private Irish Revenue Commissioners tax ruling regarding its double Irish tax structure, Apple Sales International (ASI).
511	apple	11	Apple Inc..856.apple.1	Instead of using two companies for its double Irish structure , <target>Apple<target> was given a ruling to split ASI into two internal " branches " .	Instead of using two companies for its double Irish structure , Apple was given a ruling to split ASI into two internal " branches " .	Instead of using two companies for its double Irish structure, Apple was given a ruling to split ASI into two internal "branches".
512	apple	1	Apple Inc..856.apple.1	, <target>Apple<target> agreed to start paying € 13   billion in back taxes to the Irish government , the repayments will be held in an escrow account while Apple and the Irish government continue their appeals in EU courts .	, Apple agreed to start paying € 13   billion in back taxes to the Irish government , the repayments will be held in an escrow account while Apple and the Irish government continue their appeals in EU courts .	, Apple agreed to start paying €13 billion in back taxes to the Irish government, the repayments will be held in an escrow account while Apple and the Irish government continue their appeals in EU courts.   
513	apple	28	Apple Inc..856.apple.1	, Apple agreed to start paying € 13   billion in back taxes to the Irish government , the repayments will be held in an escrow account while <target>Apple<target> and the Irish government continue their appeals in EU courts .	, Apple agreed to start paying € 13   billion in back taxes to the Irish government , the repayments will be held in an escrow account while Apple and the Irish government continue their appeals in EU courts .	, Apple agreed to start paying €13 billion in back taxes to the Irish government, the repayments will be held in an escrow account while Apple and the Irish government continue their appeals in EU courts.   
514	apple	8	Apple Inc..856.apple.1	the following individuals sit on the board of <target>Apple<target> Inc.    the current management of Apple Inc. includes :	the following individuals sit on the board of Apple Inc.    the current management of Apple Inc. includes :	the following individuals sit on the board of Apple Inc.   the current management of Apple Inc. includes:  
515	apple	15	Apple Inc..856.apple.1	the following individuals sit on the board of Apple Inc.    the current management of <target>Apple<target> Inc. includes :	the following individuals sit on the board of Apple Inc.    the current management of Apple Inc. includes :	the following individuals sit on the board of Apple Inc.   the current management of Apple Inc. includes:  
516	apple	0	Apple Inc..856.apple.1	<target>Apple<target> has been a participant in various legal proceedings and claims since it began operation .	Apple has been a participant in various legal proceedings and claims since it began operation .	Apple has been a participant in various legal proceedings and claims since it began operation.
517	apple	3	Apple Inc..856.apple.1	In particular , <target>Apple<target> is known for and promotes itself as actively and aggressively enforcing its intellectual property interests .	In particular , Apple is known for and promotes itself as actively and aggressively enforcing its intellectual property interests .	In particular, Apple is known for and promotes itself as actively and aggressively enforcing its intellectual property interests.
518	apple	5	Apple Inc..856.apple.1	Some litigation examples include " <target>Apple<target> v. Samsung " , " Apple v. Microsoft " , " Motorola Mobility v.	Some litigation examples include " Apple v. Samsung " , " Apple v. Microsoft " , " Motorola Mobility v.	Some litigation examples include "Apple v. Samsung", "Apple v. Microsoft", "Motorola Mobility v.
519	apple	11	Apple Inc..856.apple.1	Some litigation examples include " Apple v. Samsung " , " <target>Apple<target> v. Microsoft " , " Motorola Mobility v.	Some litigation examples include " Apple v. Samsung " , " Apple v. Microsoft " , " Motorola Mobility v.	Some litigation examples include "Apple v. Samsung", "Apple v. Microsoft", "Motorola Mobility v.
520	apple	0	Apple Inc..856.apple.1	<target>Apple<target> Inc. " , and " Apple Corps v. Apple Computer " .	Apple Inc. " , and " Apple Corps v. Apple Computer " .	Apple Inc.", and "Apple Corps v. Apple Computer".
521	apple	6	Apple Inc..856.apple.1	Apple Inc. " , and " <target>Apple<target> Corps v. Apple Computer " .	Apple Inc. " , and " Apple Corps v. Apple Computer " .	Apple Inc.", and "Apple Corps v. Apple Computer".
522	apple	9	Apple Inc..856.apple.1	Apple Inc. " , and " Apple Corps v. <target>Apple<target> Computer " .	Apple Inc. " , and " Apple Corps v. Apple Computer " .	Apple Inc.", and "Apple Corps v. Apple Computer".
523	apple	0	Apple Inc..856.apple.1	<target>Apple<target> has also had to defend itself against charges on numerous occasions of violating intellectual property rights .	Apple has also had to defend itself against charges on numerous occasions of violating intellectual property rights .	Apple has also had to defend itself against charges on numerous occasions of violating intellectual property rights.
524	apple	21	Apple Inc..856.apple.1	On December 21 , 2016 , Nokia announced that in the U.S. and Germany , it has filed a suit against <target>Apple<target> , claiming that the latter 's products infringe on Nokia 's patents .	On December 21 , 2016 , Nokia announced that in the U.S. and Germany , it has filed a suit against Apple , claiming that the latter 's products infringe on Nokia 's patents .	On December 21, 2016, Nokia announced that in the U.S. and Germany, it has filed a suit against Apple, claiming that the latter's products infringe on Nokia's patents.
525	apple	24	Apple Inc..856.apple.1	Most recently , in November 2017 , the United States International Trade Commission announced an investigation into allegations of patent infringement in regards to <target>Apple<target> 's remote desktop technology ; Aqua Connect , a company that builds remote desktop software , has claimed that Apple infringed on two of its patents .	Most recently , in November 2017 , the United States International Trade Commission announced an investigation into allegations of patent infringement in regards to Apple 's remote desktop technology ; Aqua Connect , a company that builds remote desktop software , has claimed that Apple infringed on two of its patents .	Most recently, in November 2017, the United States International Trade Commission announced an investigation into allegations of patent infringement in regards to Apple's remote desktop technology; Aqua Connect, a company that builds remote desktop software, has claimed that Apple infringed on two of its patents.  
526	apple	44	Apple Inc..856.apple.1	Most recently , in November 2017 , the United States International Trade Commission announced an investigation into allegations of patent infringement in regards to Apple 's remote desktop technology ; Aqua Connect , a company that builds remote desktop software , has claimed that <target>Apple<target> infringed on two of its patents .	Most recently , in November 2017 , the United States International Trade Commission announced an investigation into allegations of patent infringement in regards to Apple 's remote desktop technology ; Aqua Connect , a company that builds remote desktop software , has claimed that Apple infringed on two of its patents .	Most recently, in November 2017, the United States International Trade Commission announced an investigation into allegations of patent infringement in regards to Apple's remote desktop technology; Aqua Connect, a company that builds remote desktop software, has claimed that Apple infringed on two of its patents.  
527	apple	0	Apple Inc..856.apple.1	<target>Apple<target> has a notable pro - privacy stance , actively making privacy - conscious features and settings part of its conferences , promotional campaigns , and public image .	Apple has a notable pro - privacy stance , actively making privacy - conscious features and settings part of its conferences , promotional campaigns , and public image .	Apple has a notable pro-privacy stance, actively making privacy-conscious features and settings part of its conferences, promotional campaigns, and public image.
528	apple	9	Apple Inc..856.apple.1	With the popularity rise of cloud storage solutions , <target>Apple<target> began a technique in 2016 to do deep learning scans for facial data in photos on the user 's local device and encrypting the content before uploading it to Apple 's iCloud storage system .	With the popularity rise of cloud storage solutions , Apple began a technique in 2016 to do deep learning scans for facial data in photos on the user 's local device and encrypting the content before uploading it to Apple 's iCloud storage system .	With the popularity rise of cloud storage solutions, Apple began a technique in 2016 to do deep learning scans for facial data in photos on the user's local device and encrypting the content before uploading it to Apple's iCloud storage system.
529	apple	39	Apple Inc..856.apple.1	With the popularity rise of cloud storage solutions , Apple began a technique in 2016 to do deep learning scans for facial data in photos on the user 's local device and encrypting the content before uploading it to <target>Apple<target> 's iCloud storage system .	With the popularity rise of cloud storage solutions , Apple began a technique in 2016 to do deep learning scans for facial data in photos on the user 's local device and encrypting the content before uploading it to Apple 's iCloud storage system .	With the popularity rise of cloud storage solutions, Apple began a technique in 2016 to do deep learning scans for facial data in photos on the user's local device and encrypting the content before uploading it to Apple's iCloud storage system.
