189	apple	6	Apple Inc..856.apple.1	On April 6 , 2017 , <target>Apple<target> launched Clips , an app that allows iPad and iPhone users to make and edit short videos with text , graphics and effects .	On April 6 , 2017 , Apple launched Clips , an app that allows iPad and iPhone users to make and edit short videos with text , graphics and effects .	On April 6, 2017, Apple launched Clips, an app that allows iPad and iPhone users to make and edit short videos with text, graphics and effects.
190	apple	0	Apple Inc..856.apple.1	<target>Apple<target> also introduced Live Titles for Clips that allows users to add live animated captions and titles using their voice .	Apple also introduced Live Titles for Clips that allows users to add live animated captions and titles using their voice .	Apple also introduced Live Titles for Clips that allows users to add live animated captions and titles using their voice.  
191	apple	4	Apple Inc..856.apple.1	In May 2017 , <target>Apple<target> refreshed two of its website designs .	In May 2017 , Apple refreshed two of its website designs .	In May 2017, Apple refreshed two of its website designs.
192	apple	4	Apple Inc..856.apple.1	Their public relations " <target>Apple<target> Press Info " website was changed to an " Apple Newsroom " site , featuring a greater emphasis on imagery and therefore lower information density , and combines press releases , news items , and photos .	Their public relations " Apple Press Info " website was changed to an " Apple Newsroom " site , featuring a greater emphasis on imagery and therefore lower information density , and combines press releases , news items , and photos .	Their public relations "Apple Press Info" website was changed to an "Apple Newsroom" site, featuring a greater emphasis on imagery and therefore lower information density, and combines press releases, news items, and photos.
193	apple	14	Apple Inc..856.apple.1	Their public relations " Apple Press Info " website was changed to an " <target>Apple<target> Newsroom " site , featuring a greater emphasis on imagery and therefore lower information density , and combines press releases , news items , and photos .	Their public relations " Apple Press Info " website was changed to an " Apple Newsroom " site , featuring a greater emphasis on imagery and therefore lower information density , and combines press releases , news items , and photos .	Their public relations "Apple Press Info" website was changed to an "Apple Newsroom" site, featuring a greater emphasis on imagery and therefore lower information density, and combines press releases, news items, and photos.
194	apple	2	Apple Inc..856.apple.1	Its " <target>Apple<target> Leadership " overview of company executives was also refreshed , adding a simpler layout with a prominent header image and two - column text fields .	Its " Apple Leadership " overview of company executives was also refreshed , adding a simpler layout with a prominent header image and two - column text fields .	Its "Apple Leadership" overview of company executives was also refreshed, adding a simpler layout with a prominent header image and two-column text fields.
195	apple	10	Apple Inc..856.apple.1	" 9to5Mac " noted the design similarities to several of <target>Apple<target> 's redesigned apps in iOS 10 , particularly its Apple Music and News software .	" 9to5Mac " noted the design similarities to several of Apple 's redesigned apps in iOS 10 , particularly its Apple Music and News software .	"9to5Mac" noted the design similarities to several of Apple's redesigned apps in iOS 10, particularly its Apple Music and News software.  
196	apple	20	Apple Inc..856.apple.1	" 9to5Mac " noted the design similarities to several of Apple 's redesigned apps in iOS 10 , particularly its <target>Apple<target> Music and News software .	" 9to5Mac " noted the design similarities to several of Apple 's redesigned apps in iOS 10 , particularly its Apple Music and News software .	"9to5Mac" noted the design similarities to several of Apple's redesigned apps in iOS 10, particularly its Apple Music and News software.  
197	apple	4	Apple Inc..856.apple.1	In June 2017 , <target>Apple<target> announced the HomePod , its smart speaker aimed to compete against Sonos Google Home and Amazon Echo .	In June 2017 , Apple announced the HomePod , its smart speaker aimed to compete against Sonos Google Home and Amazon Echo .	In June 2017, Apple announced the HomePod, its smart speaker aimed to compete against Sonos Google Home and Amazon Echo.
198	apple	12	Apple Inc..856.apple.1	Towards the end of the year , " TechCrunch " reported that <target>Apple<target> was acquiring Shazam , a company specializing in music , TV , film and advertising recognition .	Towards the end of the year , " TechCrunch " reported that Apple was acquiring Shazam , a company specializing in music , TV , film and advertising recognition .	Towards the end of the year, "TechCrunch" reported that Apple was acquiring Shazam, a company specializing in music, TV, film and advertising recognition.
199	apple	11	Apple Inc..856.apple.1	The acquisition was confirmed a few days later , reportedly costing <target>Apple<target> $ 400million , with media reports noting that the purchase looked like a move by Apple to get data and tools to bolster its Apple Music streaming service .	The acquisition was confirmed a few days later , reportedly costing Apple $ 400million , with media reports noting that the purchase looked like a move by Apple to get data and tools to bolster its Apple Music streaming service .	The acquisition was confirmed a few days later, reportedly costing Apple $400million, with media reports noting that the purchase looked like a move by Apple to get data and tools to bolster its Apple Music streaming service.
200	apple	27	Apple Inc..856.apple.1	The acquisition was confirmed a few days later , reportedly costing Apple $ 400million , with media reports noting that the purchase looked like a move by <target>Apple<target> to get data and tools to bolster its Apple Music streaming service .	The acquisition was confirmed a few days later , reportedly costing Apple $ 400million , with media reports noting that the purchase looked like a move by Apple to get data and tools to bolster its Apple Music streaming service .	The acquisition was confirmed a few days later, reportedly costing Apple $400million, with media reports noting that the purchase looked like a move by Apple to get data and tools to bolster its Apple Music streaming service.
201	apple	36	Apple Inc..856.apple.1	The acquisition was confirmed a few days later , reportedly costing Apple $ 400million , with media reports noting that the purchase looked like a move by Apple to get data and tools to bolster its <target>Apple<target> Music streaming service .	The acquisition was confirmed a few days later , reportedly costing Apple $ 400million , with media reports noting that the purchase looked like a move by Apple to get data and tools to bolster its Apple Music streaming service .	The acquisition was confirmed a few days later, reportedly costing Apple $400million, with media reports noting that the purchase looked like a move by Apple to get data and tools to bolster its Apple Music streaming service.
202	apple	5	Apple Inc..856.apple.1	Also in June 2017 , <target>Apple<target> appointed Jamie Erlicht and Zack Van Amburg to head the newly formed worldwide video unit .	Also in June 2017 , Apple appointed Jamie Erlicht and Zack Van Amburg to head the newly formed worldwide video unit .	Also in June 2017, Apple appointed Jamie Erlicht and Zack Van Amburg to head the newly formed worldwide video unit.
203	apple	4	Apple Inc..856.apple.1	In November 2017 , <target>Apple<target> announced it was branching out into original scripted programming : a drama series starring Jennifer Aniston and Reese Witherspoon , and a reboot of the anthology series Amazing Stories with Steven Spielberg .	In November 2017 , Apple announced it was branching out into original scripted programming : a drama series starring Jennifer Aniston and Reese Witherspoon , and a reboot of the anthology series Amazing Stories with Steven Spielberg .	In November 2017, Apple announced it was branching out into original scripted programming: a drama series starring Jennifer Aniston and Reese Witherspoon, and a reboot of the anthology series Amazing Stories with Steven Spielberg.
204	apple	4	Apple Inc..856.apple.1	In June 2018 , <target>Apple<target> signed the Writer 's Guild of America 's minimum basic agreement and Oprah Winfrey to a multi - year content partnership .	In June 2018 , Apple signed the Writer 's Guild of America 's minimum basic agreement and Oprah Winfrey to a multi - year content partnership .	In June 2018, Apple signed the Writer's Guild of America's minimum basic agreement and Oprah Winfrey to a multi-year content partnership.
205	apple	1	Apple Inc..856.apple.1	, <target>Apple<target> has ordered twenty - one television series and one film .	, Apple has ordered twenty - one television series and one film .	, Apple has ordered twenty-one television series and one film.
206	apple	7	Apple Inc..856.apple.1	There are five series in development at <target>Apple<target> .	There are five series in development at Apple .	There are five series in development at Apple.  
207	apple	6	Apple Inc..856.apple.1	On June 5 , 2018 , <target>Apple<target> deprecated OpenGL and OpenGL ES across all operating systems and urged developers to use Metal instead .	On June 5 , 2018 , Apple deprecated OpenGL and OpenGL ES across all operating systems and urged developers to use Metal instead .	On June 5, 2018, Apple deprecated OpenGL and OpenGL ES across all operating systems and urged developers to use Metal instead.  
208	apple	4	Apple Inc..856.apple.1	In August 2018 , <target>Apple<target> purchased Akonia Holographics for its augmented reality goggle lens .	In August 2018 , Apple purchased Akonia Holographics for its augmented reality goggle lens .	In August 2018, Apple purchased Akonia Holographics for its augmented reality goggle lens.
209	apple	6	Apple Inc..856.apple.1	On February 14 , 2019 , <target>Apple<target> acquired DataTiger for its digital marketing technology .	On February 14 , 2019 , Apple acquired DataTiger for its digital marketing technology .	On February 14, 2019, Apple acquired DataTiger for its digital marketing technology.  
210	apple	6	Apple Inc..856.apple.1	On January 29 , 2019 , <target>Apple<target> reported its first decline in revenues and profits in a decade .	On January 29 , 2019 , Apple reported its first decline in revenues and profits in a decade .	On January 29, 2019, Apple reported its first decline in revenues and profits in a decade.  
211	apple	6	Apple Inc..856.apple.1	On July 25 , 2019 , <target>Apple<target> and Intel announced an agreement for Apple to acquire the smartphone modem business of Intel Mobile Communications for US$ 1 billion .	On July 25 , 2019 , Apple and Intel announced an agreement for Apple to acquire the smartphone modem business of Intel Mobile Communications for US$ 1 billion .	On July 25, 2019, Apple and Intel announced an agreement for Apple to acquire the smartphone modem business of Intel Mobile Communications for US$1 billion.  
212	apple	13	Apple Inc..856.apple.1	On July 25 , 2019 , Apple and Intel announced an agreement for <target>Apple<target> to acquire the smartphone modem business of Intel Mobile Communications for US$ 1 billion .	On July 25 , 2019 , Apple and Intel announced an agreement for Apple to acquire the smartphone modem business of Intel Mobile Communications for US$ 1 billion .	On July 25, 2019, Apple and Intel announced an agreement for Apple to acquire the smartphone modem business of Intel Mobile Communications for US$1 billion.  
213	apple	5	Apple Inc..856.apple.1	Macintoshes currently in production : <target>Apple<target> sells a variety of computer accessories for Macs , including Thunderbolt Display , Magic Mouse , Magic Trackpad , Magic Keyboard , the AirPort wireless networking products , and Time Capsule .	Macintoshes currently in production : Apple sells a variety of computer accessories for Macs , including Thunderbolt Display , Magic Mouse , Magic Trackpad , Magic Keyboard , the AirPort wireless networking products , and Time Capsule .	Macintoshes currently in production: Apple sells a variety of computer accessories for Macs, including Thunderbolt Display, Magic Mouse, Magic Trackpad, Magic Keyboard, the AirPort wireless networking products, and Time Capsule.  
214	apple	6	Apple Inc..856.apple.1	On October 23 , 2001 , <target>Apple<target> introduced the iPod digital music player .	On October 23 , 2001 , Apple introduced the iPod digital music player .	On October 23, 2001, Apple introduced the iPod digital music player.
215	apple	0	Apple Inc..856.apple.1	<target>Apple<target> has partnered with Nike to offer the Nike+iPod Sports Kit , enabling runners to synchronize and monitor their runs with iTunes and the Nike+ website .	Apple has partnered with Nike to offer the Nike+iPod Sports Kit , enabling runners to synchronize and monitor their runs with iTunes and the Nike+ website .	Apple has partnered with Nike to offer the Nike+iPod Sports Kit, enabling runners to synchronize and monitor their runs with iTunes and the Nike+ website.  
216	apple	5	Apple Inc..856.apple.1	In late July 2017 , <target>Apple<target> discontinued its iPod Nano and iPod Shuffle models , leaving only the iPod Touch available for purchase .	In late July 2017 , Apple discontinued its iPod Nano and iPod Shuffle models , leaving only the iPod Touch available for purchase .	In late July 2017, Apple discontinued its iPod Nano and iPod Shuffle models, leaving only the iPod Touch available for purchase.  
217	apple	6	Apple Inc..856.apple.1	On June 8 , 2009 , <target>Apple<target> announced the iPhone 3GS .	On June 8 , 2009 , Apple announced the iPhone 3GS .	On June 8, 2009, Apple announced the iPhone 3GS.
218	apple	14	Apple Inc..856.apple.1	At the Worldwide Developers Conference ( WWDC ) on June 7 , 2010 , <target>Apple<target> announced the redesigned iPhone 4 .	At the Worldwide Developers Conference ( WWDC ) on June 7 , 2010 , Apple announced the redesigned iPhone 4 .	At the Worldwide Developers Conference (WWDC) on June 7, 2010, Apple announced the redesigned iPhone 4.
219	apple	9	Apple Inc..856.apple.1	It featured a 960 × 640 display , the <target>Apple<target> A4 processor , a gyroscope for enhanced gaming , a 5MP camera with LED flash , front - facing VGA camera and FaceTime video calling .	It featured a 960 × 640 display , the Apple A4 processor , a gyroscope for enhanced gaming , a 5MP camera with LED flash , front - facing VGA camera and FaceTime video calling .	It featured a 960 × 640 display, the Apple A4 processor, a gyroscope for enhanced gaming, a 5MP camera with LED flash, front-facing VGA camera and FaceTime video calling.
220	apple	12	Apple Inc..856.apple.1	The issue was corrected by a " Bumper Case " distributed by <target>Apple<target> for free to all owners for a few months .	The issue was corrected by a " Bumper Case " distributed by Apple for free to all owners for a few months .	The issue was corrected by a "Bumper Case" distributed by Apple for free to all owners for a few months.
221	apple	4	Apple Inc..856.apple.1	In June 2011 , <target>Apple<target> overtook Nokia to become the world 's biggest smartphone maker by volume .	In June 2011 , Apple overtook Nokia to become the world 's biggest smartphone maker by volume .	In June 2011, Apple overtook Nokia to become the world's biggest smartphone maker by volume.
222	apple	6	Apple Inc..856.apple.1	On October 4 , 2011 , <target>Apple<target> unveiled the iPhone 4S , which was first released on October 14 , 2011 .	On October 4 , 2011 , Apple unveiled the iPhone 4S , which was first released on October 14 , 2011 .	On October 4, 2011, Apple unveiled the iPhone 4S, which was first released on October 14, 2011.
223	apple	3	Apple Inc..856.apple.1	It features the <target>Apple<target> A5 processor and Siri voice assistant technology , the latter of which Apple had acquired in 2010 from SRI International Artificial Intelligence Center .	It features the Apple A5 processor and Siri voice assistant technology , the latter of which Apple had acquired in 2010 from SRI International Artificial Intelligence Center .	It features the Apple A5 processor and Siri voice assistant technology, the latter of which Apple had acquired in 2010 from SRI International Artificial Intelligence Center.
224	apple	16	Apple Inc..856.apple.1	It features the Apple A5 processor and Siri voice assistant technology , the latter of which <target>Apple<target> had acquired in 2010 from SRI International Artificial Intelligence Center .	It features the Apple A5 processor and Siri voice assistant technology , the latter of which Apple had acquired in 2010 from SRI International Artificial Intelligence Center .	It features the Apple A5 processor and Siri voice assistant technology, the latter of which Apple had acquired in 2010 from SRI International Artificial Intelligence Center.
225	apple	0	Apple Inc..856.apple.1	<target>Apple<target> began a new accessibility feature , Made for iPhone Hearing Aids with the iPhone 4S. Made for iPhone Hearing Aids	Apple began a new accessibility feature , Made for iPhone Hearing Aids with the iPhone 4S. Made for iPhone Hearing Aids	Apple began a new accessibility feature, Made for iPhone Hearing Aids with the iPhone 4S. Made for iPhone Hearing Aids
226	apple	0	Apple Inc..856.apple.1	<target>Apple<target> sold 4million iPhone 4S phones in the first three days of availability .	Apple sold 4million iPhone 4S phones in the first three days of availability .	Apple sold 4million iPhone 4S phones in the first three days of availability.  
227	apple	6	Apple Inc..856.apple.1	On September 12 , 2012 , <target>Apple<target> introduced the iPhone 5 .	On September 12 , 2012 , Apple introduced the iPhone 5 .	On September 12, 2012, Apple introduced the iPhone 5.
228	apple	14	Apple Inc..856.apple.1	It has a 4-inch display , 4 G LTE connectivity , and the upgraded <target>Apple<target> A6 chip , among several other improvements .	It has a 4-inch display , 4 G LTE connectivity , and the upgraded Apple A6 chip , among several other improvements .	It has a 4-inch display, 4G LTE connectivity, and the upgraded Apple A6 chip, among several other improvements.
229	apple	11	Apple Inc..856.apple.1	Upon the launch of the iPhone 5S and iPhone 5C , <target>Apple<target> set a new record for first - weekend smartphone sales by selling over nine million devices in the first three days of its launch .	Upon the launch of the iPhone 5S and iPhone 5C , Apple set a new record for first - weekend smartphone sales by selling over nine million devices in the first three days of its launch .	Upon the launch of the iPhone 5S and iPhone 5C, Apple set a new record for first-weekend smartphone sales by selling over nine million devices in the first three days of its launch.
230	apple	13	Apple Inc..856.apple.1	The release of the iPhone 5S and 5C is the first time that <target>Apple<target> simultaneously launched two models .	The release of the iPhone 5S and 5C is the first time that Apple simultaneously launched two models .	The release of the iPhone 5S and 5C is the first time that Apple simultaneously launched two models.  
231	apple	0	Apple Inc..856.apple.1	<target>Apple<target> is working towards a power management system that will provide features such as the ability of the iPhone to estimate the length of time a user will be away from a power source to modify energy usage and a detection function that adjusts the charging rate to best suit the type of power source that is being used .	Apple is working towards a power management system that will provide features such as the ability of the iPhone to estimate the length of time a user will be away from a power source to modify energy usage and a detection function that adjusts the charging rate to best suit the type of power source that is being used .	Apple is working towards a power management system that will provide features such as the ability of the iPhone to estimate the length of time a user will be away from a power source to modify energy usage and a detection function that adjusts the charging rate to best suit the type of power source that is being used.  
232	apple	6	Apple Inc..856.apple.1	In a March 2014 interview , <target>Apple<target> designer Jonathan I ve used the iPhone as an example of Apple 's ethos of creating high - quality , life - changing products .	In a March 2014 interview , Apple designer Jonathan I ve used the iPhone as an example of Apple 's ethos of creating high - quality , life - changing products .	In a March 2014 interview, Apple designer Jonathan Ive used the iPhone as an example of Apple's ethos of creating high-quality, life-changing products.
233	apple	18	Apple Inc..856.apple.1	In a March 2014 interview , Apple designer Jonathan I ve used the iPhone as an example of <target>Apple<target> 's ethos of creating high - quality , life - changing products .	In a March 2014 interview , Apple designer Jonathan I ve used the iPhone as an example of Apple 's ethos of creating high - quality , life - changing products .	In a March 2014 interview, Apple designer Jonathan Ive used the iPhone as an example of Apple's ethos of creating high-quality, life-changing products.
234	apple	6	Apple Inc..856.apple.1	On September 9 , 2014 , <target>Apple<target> introduced the iPhone 6 , alongside the iPhone 6	On September 9 , 2014 , Apple introduced the iPhone 6 , alongside the iPhone 6	On September 9, 2014, Apple introduced the iPhone 6, alongside the iPhone 6
235	apple	4	Apple Inc..856.apple.1	One year later , <target>Apple<target> introduced the iPhone 6S , and iPhone 6S Plus , which introduced a new technology called 3D Touch , including an increase of the rear camera to 12 MP , and the FaceTime camera to 5 MP .	One year later , Apple introduced the iPhone 6S , and iPhone 6S Plus , which introduced a new technology called 3D Touch , including an increase of the rear camera to 12 MP , and the FaceTime camera to 5 MP .	One year later, Apple introduced the iPhone 6S, and iPhone 6S Plus, which introduced a new technology called 3D Touch, including an increase of the rear camera to 12 MP, and the FaceTime camera to 5 MP.
236	apple	6	Apple Inc..856.apple.1	On March 21 , 2016 , <target>Apple<target> introduced the iPhone SE that has a 4-inch screen size last used with the 5S and has nearly the same internal hardware as the 6S.	On March 21 , 2016 , Apple introduced the iPhone SE that has a 4-inch screen size last used with the 5S and has nearly the same internal hardware as the 6S.	On March 21, 2016, Apple introduced the iPhone SE that has a 4-inch screen size last used with the 5S and has nearly the same internal hardware as the 6S.  
237	apple	4	Apple Inc..856.apple.1	In July 2016 , <target>Apple<target> announced that one billion iPhones had been sold .	In July 2016 , Apple announced that one billion iPhones had been sold .	In July 2016, Apple announced that one billion iPhones had been sold.  
238	apple	6	Apple Inc..856.apple.1	On September 7 , 2016 , <target>Apple<target> introduced the iPhone 7 and the iPhone 7 Plus , which feature improved system and graphics performance , add water resistance , a new rear dual - camera system on the 7 Plus model , and , controversially , remove the 3.5   mm headphone jack .	On September 7 , 2016 , Apple introduced the iPhone 7 and the iPhone 7 Plus , which feature improved system and graphics performance , add water resistance , a new rear dual - camera system on the 7 Plus model , and , controversially , remove the 3.5   mm headphone jack .	On September 7, 2016, Apple introduced the iPhone 7 and the iPhone 7 Plus, which feature improved system and graphics performance, add water resistance, a new rear dual-camera system on the 7 Plus model, and, controversially, remove the 3.5 mm headphone jack.
239	apple	6	Apple Inc..856.apple.1	On September 12 , 2017 , <target>Apple<target> introduced the iPhone 8 and iPhone 8 Plus , standing as evolutionary updates to its previous phones with a faster processor , improved display technology , upgraded camera systems and wireless charging .	On September 12 , 2017 , Apple introduced the iPhone 8 and iPhone 8 Plus , standing as evolutionary updates to its previous phones with a faster processor , improved display technology , upgraded camera systems and wireless charging .	On September 12, 2017, Apple introduced the iPhone 8 and iPhone 8 Plus, standing as evolutionary updates to its previous phones with a faster processor, improved display technology, upgraded camera systems and wireless charging.
240	apple	6	Apple Inc..856.apple.1	On September 12 , 2018 , <target>Apple<target> introduced the iPhone XS , iPhone XS Max and iPhone XR .	On September 12 , 2018 , Apple introduced the iPhone XS , iPhone XS Max and iPhone XR .	On September 12, 2018, Apple introduced the iPhone XS, iPhone XS Max and iPhone XR.
241	apple	6	Apple Inc..856.apple.1	On January 27 , 2010 , <target>Apple<target> introduced their much - anticipated media tablet , the iPad .	On January 27 , 2010 , Apple introduced their much - anticipated media tablet , the iPad .	On January 27, 2010, Apple introduced their much-anticipated media tablet, the iPad.
242	apple	6	Apple Inc..856.apple.1	On March 2 , 2011 , <target>Apple<target> introduced the iPad 2 , which had a faster processor and a camera on the front and back .	On March 2 , 2011 , Apple introduced the iPad 2 , which had a faster processor and a camera on the front and back .	On March 2, 2011, Apple introduced the iPad 2, which had a faster processor and a camera on the front and back.
