0	apple	0	Apple Inc..856.apple.1	<target>Apple<target> Inc. is an American multinational technology company headquartered in Cupertino , California , that designs , develops , and sells consumer electronics , computer software , and online services .	Apple Inc. is an American multinational technology company headquartered in Cupertino , California , that designs , develops , and sells consumer electronics , computer software , and online services .	Apple Inc. is an American multinational technology company headquartered in Cupertino, California, that designs, develops, and sells consumer electronics, computer software, and online services.
1	apple	27	Apple Inc..856.apple.1	The company 's hardware products include the iPhone smartphone , the iPad tablet computer , the Mac personal computer , the iPod portable media player , the <target>Apple<target> Watch smartwatch , the Apple TV digital media player , the AirPods wireless earbuds and the HomePod smart speaker .	The company 's hardware products include the iPhone smartphone , the iPad tablet computer , the Mac personal computer , the iPod portable media player , the Apple Watch smartwatch , the Apple TV digital media player , the AirPods wireless earbuds and the HomePod smart speaker .	The company's hardware products include the iPhone smartphone, the iPad tablet computer, the Mac personal computer, the iPod portable media player, the Apple Watch smartwatch, the Apple TV digital media player, the AirPods wireless earbuds and the HomePod smart speaker.
2	apple	32	Apple Inc..856.apple.1	The company 's hardware products include the iPhone smartphone , the iPad tablet computer , the Mac personal computer , the iPod portable media player , the Apple Watch smartwatch , the <target>Apple<target> TV digital media player , the AirPods wireless earbuds and the HomePod smart speaker .	The company 's hardware products include the iPhone smartphone , the iPad tablet computer , the Mac personal computer , the iPod portable media player , the Apple Watch smartwatch , the Apple TV digital media player , the AirPods wireless earbuds and the HomePod smart speaker .	The company's hardware products include the iPhone smartphone, the iPad tablet computer, the Mac personal computer, the iPod portable media player, the Apple Watch smartwatch, the Apple TV digital media player, the AirPods wireless earbuds and the HomePod smart speaker.
3	apple	0	Apple Inc..856.apple.1	<target>Apple<target> 's software includes the macOS , iOS , iPadOS , watchOS , and tvOS operating systems , the iTunes media player , the Safari web browser , and the iLife and iWork creativity and productivity suites , as well as professional applications like Final Cut Pro , Logic Pro , and Xcode .	Apple 's software includes the macOS , iOS , iPadOS , watchOS , and tvOS operating systems , the iTunes media player , the Safari web browser , and the iLife and iWork creativity and productivity suites , as well as professional applications like Final Cut Pro , Logic Pro , and Xcode .	Apple's software includes the macOS, iOS, iPadOS, watchOS, and tvOS operating systems, the iTunes media player, the Safari web browser, and the iLife and iWork creativity and productivity suites, as well as professional applications like Final Cut Pro, Logic Pro, and Xcode.
4	apple	17	Apple Inc..856.apple.1	Its online services include the iTunes Store , the iOS App Store , Mac App Store , <target>Apple<target> Music , Apple TV+ , iMessage , and iCloud .	Its online services include the iTunes Store , the iOS App Store , Mac App Store , Apple Music , Apple TV+ , iMessage , and iCloud .	Its online services include the iTunes Store, the iOS App Store, Mac App Store, Apple Music, Apple TV+, iMessage, and iCloud.
5	apple	20	Apple Inc..856.apple.1	Its online services include the iTunes Store , the iOS App Store , Mac App Store , Apple Music , <target>Apple<target> TV+ , iMessage , and iCloud .	Its online services include the iTunes Store , the iOS App Store , Mac App Store , Apple Music , Apple TV+ , iMessage , and iCloud .	Its online services include the iTunes Store, the iOS App Store, Mac App Store, Apple Music, Apple TV+, iMessage, and iCloud.
6	apple	3	Apple Inc..856.apple.1	Other services include <target>Apple<target> Store , Genius Bar , AppleCare , Apple Pay , Apple Pay Cash , and Apple Card .	Other services include Apple Store , Genius Bar , AppleCare , Apple Pay , Apple Pay Cash , and Apple Card .	Other services include Apple Store, Genius Bar, AppleCare, Apple Pay, Apple Pay Cash, and Apple Card.  
7	apple	11	Apple Inc..856.apple.1	Other services include Apple Store , Genius Bar , AppleCare , <target>Apple<target> Pay , Apple Pay Cash , and Apple Card .	Other services include Apple Store , Genius Bar , AppleCare , Apple Pay , Apple Pay Cash , and Apple Card .	Other services include Apple Store, Genius Bar, AppleCare, Apple Pay, Apple Pay Cash, and Apple Card.  
8	apple	14	Apple Inc..856.apple.1	Other services include Apple Store , Genius Bar , AppleCare , Apple Pay , <target>Apple<target> Pay Cash , and Apple Card .	Other services include Apple Store , Genius Bar , AppleCare , Apple Pay , Apple Pay Cash , and Apple Card .	Other services include Apple Store, Genius Bar, AppleCare, Apple Pay, Apple Pay Cash, and Apple Card.  
9	apple	19	Apple Inc..856.apple.1	Other services include Apple Store , Genius Bar , AppleCare , Apple Pay , Apple Pay Cash , and <target>Apple<target> Card .	Other services include Apple Store , Genius Bar , AppleCare , Apple Pay , Apple Pay Cash , and Apple Card .	Other services include Apple Store, Genius Bar, AppleCare, Apple Pay, Apple Pay Cash, and Apple Card.  
10	apple	0	Apple Inc..856.apple.1	<target>Apple<target> was founded by Steve Jobs , Steve Wozniak , and Ronald Wayne in April 1976 to develop and sell Wozniak 's Apple I personal computer , though Wayne sold his share back within 12 days .	Apple was founded by Steve Jobs , Steve Wozniak , and Ronald Wayne in April 1976 to develop and sell Wozniak 's Apple I personal computer , though Wayne sold his share back within 12 days .	Apple was founded by Steve Jobs, Steve Wozniak, and Ronald Wayne in April 1976 to develop and sell Wozniak's Apple I personal computer, though Wayne sold his share back within 12 days.
11	apple	22	Apple Inc..856.apple.1	Apple was founded by Steve Jobs , Steve Wozniak , and Ronald Wayne in April 1976 to develop and sell Wozniak 's <target>Apple<target> I personal computer , though Wayne sold his share back within 12 days .	Apple was founded by Steve Jobs , Steve Wozniak , and Ronald Wayne in April 1976 to develop and sell Wozniak 's Apple I personal computer , though Wayne sold his share back within 12 days .	Apple was founded by Steve Jobs, Steve Wozniak, and Ronald Wayne in April 1976 to develop and sell Wozniak's Apple I personal computer, though Wayne sold his share back within 12 days.
12	apple	4	Apple Inc..856.apple.1	It was incorporated as <target>Apple<target> Computer , Inc. , in January 1977 , and sales of its computers , including the Apple II , grew quickly .	It was incorporated as Apple Computer , Inc. , in January 1977 , and sales of its computers , including the Apple II , grew quickly .	It was incorporated as Apple Computer, Inc., in January 1977, and sales of its computers, including the Apple II, grew quickly.
13	apple	21	Apple Inc..856.apple.1	It was incorporated as Apple Computer , Inc. , in January 1977 , and sales of its computers , including the <target>Apple<target> II , grew quickly .	It was incorporated as Apple Computer , Inc. , in January 1977 , and sales of its computers , including the Apple II , grew quickly .	It was incorporated as Apple Computer, Inc., in January 1977, and sales of its computers, including the Apple II, grew quickly.
14	apple	0	Apple Inc..856.apple.1	<target>Apple<target> went public in 1980 to instant financial success .	Apple went public in 1980 to instant financial success .	Apple went public in 1980 to instant financial success.
15	apple	6	Apple Inc..856.apple.1	Over the next few years , <target>Apple<target> shipped new computers featuring innovative graphical user interfaces , such as the original Macintosh in 1984 , and Apple 's marketing advertisements for its products received widespread critical acclaim .	Over the next few years , Apple shipped new computers featuring innovative graphical user interfaces , such as the original Macintosh in 1984 , and Apple 's marketing advertisements for its products received widespread critical acclaim .	Over the next few years, Apple shipped new computers featuring innovative graphical user interfaces, such as the original Macintosh in 1984, and Apple's marketing advertisements for its products received widespread critical acclaim.
16	apple	25	Apple Inc..856.apple.1	Over the next few years , Apple shipped new computers featuring innovative graphical user interfaces , such as the original Macintosh in 1984 , and <target>Apple<target> 's marketing advertisements for its products received widespread critical acclaim .	Over the next few years , Apple shipped new computers featuring innovative graphical user interfaces , such as the original Macintosh in 1984 , and Apple 's marketing advertisements for its products received widespread critical acclaim .	Over the next few years, Apple shipped new computers featuring innovative graphical user interfaces, such as the original Macintosh in 1984, and Apple's marketing advertisements for its products received widespread critical acclaim.
17	apple	5	Apple Inc..856.apple.1	In 1985 , Wozniak departed <target>Apple<target> amicably and remained an honorary employee , while Jobs and others resigned to found NeXT .	In 1985 , Wozniak departed Apple amicably and remained an honorary employee , while Jobs and others resigned to found NeXT .	In 1985, Wozniak departed Apple amicably and remained an honorary employee, while Jobs and others resigned to found NeXT.  
18	apple	13	Apple Inc..856.apple.1	As the market for personal computers expanded and evolved through the 1990s , <target>Apple<target> lost market share to the lower - priced duopoly of Microsoft Windows on Intel PC clones .	As the market for personal computers expanded and evolved through the 1990s , Apple lost market share to the lower - priced duopoly of Microsoft Windows on Intel PC clones .	As the market for personal computers expanded and evolved through the 1990s, Apple lost market share to the lower-priced duopoly of Microsoft Windows on Intel PC clones.
19	apple	5	Apple Inc..856.apple.1	In 1997 , he led <target>Apple<target> to buy NeXT , solving the desperately failed operating system strategy and bringing Jobs back .	In 1997 , he led Apple to buy NeXT , solving the desperately failed operating system strategy and bringing Jobs back .	In 1997, he led Apple to buy NeXT, solving the desperately failed operating system strategy and bringing Jobs back.
20	apple	0	Apple Inc..856.apple.1	<target>Apple<target> swiftly returned to profitability under the revitalizing	Apple swiftly returned to profitability under the revitalizing	Apple swiftly returned to profitability under the revitalizing
21	apple	7	Apple Inc..856.apple.1	Think different campaign , as he rebuilt <target>Apple<target> 's status by launching the iMac in 1998 , opening the retail chain of Apple Stores in 2001 , and acquiring numerous companies to broaden the software portfolio .	Think different campaign , as he rebuilt Apple 's status by launching the iMac in 1998 , opening the retail chain of Apple Stores in 2001 , and acquiring numerous companies to broaden the software portfolio .	Think different campaign, as he rebuilt Apple's status by launching the iMac in 1998, opening the retail chain of Apple Stores in 2001, and acquiring numerous companies to broaden the software portfolio.
22	apple	22	Apple Inc..856.apple.1	Think different campaign , as he rebuilt Apple 's status by launching the iMac in 1998 , opening the retail chain of <target>Apple<target> Stores in 2001 , and acquiring numerous companies to broaden the software portfolio .	Think different campaign , as he rebuilt Apple 's status by launching the iMac in 1998 , opening the retail chain of Apple Stores in 2001 , and acquiring numerous companies to broaden the software portfolio .	Think different campaign, as he rebuilt Apple's status by launching the iMac in 1998, opening the retail chain of Apple Stores in 2001, and acquiring numerous companies to broaden the software portfolio.
23	apple	8	Apple Inc..856.apple.1	In January 2007 , Jobs renamed the company <target>Apple<target> Inc. , reflecting its shifted focus toward consumer electronics , and launched the iPhone to great critical acclaim and financial success .	In January 2007 , Jobs renamed the company Apple Inc. , reflecting its shifted focus toward consumer electronics , and launched the iPhone to great critical acclaim and financial success .	In January 2007, Jobs renamed the company Apple Inc., reflecting its shifted focus toward consumer electronics, and launched the iPhone to great critical acclaim and financial success.
24	apple	0	Apple Inc..856.apple.1	<target>Apple<target> is well known for its size and revenues .	Apple is well known for its size and revenues .	Apple is well known for its size and revenues.
25	apple	0	Apple Inc..856.apple.1	<target>Apple<target> is the world 's largest technology company by revenue and one of the world 's most valuable companies .	Apple is the world 's largest technology company by revenue and one of the world 's most valuable companies .	Apple is the world's largest technology company by revenue and one of the world's most valuable companies.
26	apple	4	Apple Inc..856.apple.1	In August 2018 , <target>Apple<target> became the first public U.S. company to be valued at over $ 1   trillion .	In August 2018 , Apple became the first public U.S. company to be valued at over $ 1   trillion .	In August 2018, Apple became the first public U.S. company to be valued at over $1 trillion.
27	apple	21	Apple Inc..856.apple.1	It operates the iTunes Store , which is the world 's largest music retailer . , more than 1.3   billion <target>Apple<target> products are actively in use worldwide .	It operates the iTunes Store , which is the world 's largest music retailer . , more than 1.3   billion Apple products are actively in use worldwide .	It operates the iTunes Store, which is the world's largest music retailer. , more than 1.3 billion Apple products are actively in use worldwide.
28	apple	2	Apple Inc..856.apple.1	However , <target>Apple<target> receives significant criticism regarding the labor practices of its contractors , its environmental practices and unethical business practices , including anti - competitive behavior , as well as the origins of source materials .	However , Apple receives significant criticism regarding the labor practices of its contractors , its environmental practices and unethical business practices , including anti - competitive behavior , as well as the origins of source materials .	However, Apple receives significant criticism regarding the labor practices of its contractors, its environmental practices and unethical business practices, including anti-competitive behavior, as well as the origins of source materials.  
29	apple	0	Apple Inc..856.apple.1	<target>Apple<target> Computer Company was founded on April 1 , 1976 , by Steve Jobs , Steve Wozniak , and Ronald Wayne .	Apple Computer Company was founded on April 1 , 1976 , by Steve Jobs , Steve Wozniak , and Ronald Wayne .	Apple Computer Company was founded on April 1, 1976, by Steve Jobs, Steve Wozniak, and Ronald Wayne.
30	apple	7	Apple Inc..856.apple.1	The company 's first product is the <target>Apple<target> I , a computer designed and hand - built entirely by Wozniak , and first shown to the public at the Homebrew Computer Club .	The company 's first product is the Apple I , a computer designed and hand - built entirely by Wozniak , and first shown to the public at the Homebrew Computer Club .	The company's first product is the Apple I, a computer designed and hand-built entirely by Wozniak, and first shown to the public at the Homebrew Computer Club.
31	apple	0	Apple Inc..856.apple.1	<target>Apple<target> I was sold as a motherboard ( with CPU , RAM , and basic textual - video chips)—a base kit concept which would now not be marketed as a complete personal computer .	Apple I was sold as a motherboard ( with CPU , RAM , and basic textual - video chips)—a base kit concept which would now not be marketed as a complete personal computer .	Apple I was sold as a motherboard (with CPU, RAM, and basic textual-video chips)—a base kit concept which would now not be marketed as a complete personal computer.
32	apple	1	Apple Inc..856.apple.1	The <target>Apple<target> I went on sale in July 1976 and was market - priced at $ 666.66 ( $ in dollars , adjusted for inflation ) .	The Apple I went on sale in July 1976 and was market - priced at $ 666.66 ( $ in dollars , adjusted for inflation ) .	The Apple I went on sale in July 1976 and was market-priced at $666.66 ($ in dollars, adjusted for inflation).  
33	apple	0	Apple Inc..856.apple.1	<target>Apple<target> Computer , Inc. was incorporated on January 3 , 1977 , without Wayne , who had left and sold his share of the company back to Jobs and Wozniak for $ 800 only twelve days after having co - founded Apple .	Apple Computer , Inc. was incorporated on January 3 , 1977 , without Wayne , who had left and sold his share of the company back to Jobs and Wozniak for $ 800 only twelve days after having co - founded Apple .	Apple Computer, Inc. was incorporated on January 3, 1977, without Wayne, who had left and sold his share of the company back to Jobs and Wozniak for $800 only twelve days after having co-founded Apple.
34	apple	41	Apple Inc..856.apple.1	Apple Computer , Inc. was incorporated on January 3 , 1977 , without Wayne , who had left and sold his share of the company back to Jobs and Wozniak for $ 800 only twelve days after having co - founded <target>Apple<target> .	Apple Computer , Inc. was incorporated on January 3 , 1977 , without Wayne , who had left and sold his share of the company back to Jobs and Wozniak for $ 800 only twelve days after having co - founded Apple .	Apple Computer, Inc. was incorporated on January 3, 1977, without Wayne, who had left and sold his share of the company back to Jobs and Wozniak for $800 only twelve days after having co-founded Apple.
35	apple	16	Apple Inc..856.apple.1	Multimillionaire Mike Markkula provided essential business expertise and funding of $ 250,000 during the incorporation of <target>Apple<target> .	Multimillionaire Mike Markkula provided essential business expertise and funding of $ 250,000 during the incorporation of Apple .	Multimillionaire Mike Markkula provided essential business expertise and funding of $250,000 during the incorporation of Apple.
36	apple	1	Apple Inc..856.apple.1	The <target>Apple<target> II , also invented by Wozniak , was introduced on April 16 , 1977 , at the first West Coast Computer Faire .	The Apple II , also invented by Wozniak , was introduced on April 16 , 1977 , at the first West Coast Computer Faire .	The Apple II, also invented by Wozniak, was introduced on April 16, 1977, at the first West Coast Computer Faire.
37	apple	2	Apple Inc..856.apple.1	While early <target>Apple<target> II models use ordinary cassette tapes as storage devices , they were superseded by the introduction of a -inch floppy disk drive and interface called the Disk II .	While early Apple II models use ordinary cassette tapes as storage devices , they were superseded by the introduction of a -inch floppy disk drive and interface called the Disk II .	While early Apple II models use ordinary cassette tapes as storage devices, they were superseded by the introduction of a -inch floppy disk drive and interface called the Disk II.
38	apple	1	Apple Inc..856.apple.1	The <target>Apple<target> II was chosen to be the desktop platform for the first " killer app " of the business world : VisiCalc , a spreadsheet program .	The Apple II was chosen to be the desktop platform for the first " killer app " of the business world : VisiCalc , a spreadsheet program .	The Apple II was chosen to be the desktop platform for the first "killer app" of the business world: VisiCalc, a spreadsheet program.
39	apple	7	Apple Inc..856.apple.1	VisiCalc created a business market for the <target>Apple<target> II and gave home users an additional reason to buy an Apple II : compatibility with the office .	VisiCalc created a business market for the Apple II and gave home users an additional reason to buy an Apple II : compatibility with the office .	VisiCalc created a business market for the Apple II and gave home users an additional reason to buy an Apple II: compatibility with the office.
40	apple	19	Apple Inc..856.apple.1	VisiCalc created a business market for the Apple II and gave home users an additional reason to buy an <target>Apple<target> II : compatibility with the office .	VisiCalc created a business market for the Apple II and gave home users an additional reason to buy an Apple II : compatibility with the office .	VisiCalc created a business market for the Apple II and gave home users an additional reason to buy an Apple II: compatibility with the office.
41	apple	3	Apple Inc..856.apple.1	Before VisiCalc , <target>Apple<target> had been a distant third place competitor to Commodore and Tandy .	Before VisiCalc , Apple had been a distant third place competitor to Commodore and Tandy .	Before VisiCalc, Apple had been a distant third place competitor to Commodore and Tandy.  
42	apple	7	Apple Inc..856.apple.1	By the end of the 1970s , <target>Apple<target> had a staff of computer designers and a production line .	By the end of the 1970s , Apple had a staff of computer designers and a production line .	By the end of the 1970s, Apple had a staff of computer designers and a production line.
43	apple	4	Apple Inc..856.apple.1	The company introduced the <target>Apple<target> III in May 1980 in an attempt to compete with IBM in the business and corporate computing market .	The company introduced the Apple III in May 1980 in an attempt to compete with IBM in the business and corporate computing market .	The company introduced the Apple III in May 1980 in an attempt to compete with IBM in the business and corporate computing market.
44	apple	3	Apple Inc..856.apple.1	Jobs and several <target>Apple<target> employees , including human – computer interface expert Jef Raskin , visited Xerox PARC in December 1979 to see a demonstration of the Xerox Alto .	Jobs and several Apple employees , including human – computer interface expert Jef Raskin , visited Xerox PARC in December 1979 to see a demonstration of the Xerox Alto .	Jobs and several Apple employees, including human–computer interface expert Jef Raskin, visited Xerox PARC in December 1979 to see a demonstration of the Xerox Alto.
45	apple	2	Apple Inc..856.apple.1	Xerox granted <target>Apple<target> engineers three days of access to the PARC facilities in return for the option to buy 100,000 shares ( 5.6   million split - adjusted shares ) of Apple at the pre - IPO price of $ 10 a share .	Xerox granted Apple engineers three days of access to the PARC facilities in return for the option to buy 100,000 shares ( 5.6   million split - adjusted shares ) of Apple at the pre - IPO price of $ 10 a share .	Xerox granted Apple engineers three days of access to the PARC facilities in return for the option to buy 100,000 shares (5.6 million split-adjusted shares ) of Apple at the pre-IPO price of $10 a share.  
46	apple	31	Apple Inc..856.apple.1	Xerox granted Apple engineers three days of access to the PARC facilities in return for the option to buy 100,000 shares ( 5.6   million split - adjusted shares ) of <target>Apple<target> at the pre - IPO price of $ 10 a share .	Xerox granted Apple engineers three days of access to the PARC facilities in return for the option to buy 100,000 shares ( 5.6   million split - adjusted shares ) of Apple at the pre - IPO price of $ 10 a share .	Xerox granted Apple engineers three days of access to the PARC facilities in return for the option to buy 100,000 shares (5.6 million split-adjusted shares ) of Apple at the pre-IPO price of $10 a share.  
47	apple	26	Apple Inc..856.apple.1	Jobs was immediately convinced that all future computers would use a graphical user interface ( GUI ) , and development of a GUI began for the <target>Apple<target> Lisa .	Jobs was immediately convinced that all future computers would use a graphical user interface ( GUI ) , and development of a GUI began for the Apple Lisa .	Jobs was immediately convinced that all future computers would use a graphical user interface (GUI), and development of a GUI began for the Apple Lisa.
48	apple	6	Apple Inc..856.apple.1	On December 12 , 1980 , <target>Apple<target> ( ticker symbol " AAPL " ) went public selling 4.6   million shares at $ 22 per share ( $ .39 per share when adjusting for stock splits ) , generating over $ 100   million , which was more capital than any IPO since Ford Motor Company in 1956 .	On December 12 , 1980 , Apple ( ticker symbol " AAPL " ) went public selling 4.6   million shares at $ 22 per share ( $ .39 per share when adjusting for stock splits ) , generating over $ 100   million , which was more capital than any IPO since Ford Motor Company in 1956 .	On December 12, 1980, Apple (ticker symbol "AAPL") went public selling 4.6 million shares at $22 per share ($.39 per share when adjusting for stock splits ), generating over $100 million, which was more capital than any IPO since Ford Motor Company in 1956.
